place_id,place_name,review_id,reviewer_name,rating,review_text,published_at,published_at_date,response_from_owner_text,response_from_owner_ago,response_from_owner_date,review_likes_count,total_number_of_reviews_by_reviewer,total_number_of_photos_by_reviewer,reviewer_url,is_local_guide,review_translated_text,response_from_owner_translated_text
ChIJdQ1jud1zhlQRrzO3fVYUkyg,The Home Depot,ChZDSUhNMG9nS0VJQ0FnSUNoaS1TaVJREAE,Lonnie Santrock,5,"I encountered 2 of the nicest most professional sales associates ever, I wish Id taken the time to get names, one was in home lighting area and another in the electric fireplace area. Both took the time to ensure my pleasure in purchase. 100% satisfaction",8 months ago,2023-03-18 21:37:09.138256,,,,0,52,1364,https://www.google.com/maps/contrib/118214459309434736612/reviews?entry=ttu,True,,
ChIJdQ1jud1zhlQRrzO3fVYUkyg,The Home Depot,ChdDSUhNMG9nS0VJQ0FnSUR5N2MtdXZBRRAB,Jp,5,I had a great experienced during my visit.5 star for Rod with this initial RN  (staff from paint section) He helped me getting the right colour. Very patience helping me as he tried many times to get the right one that I need.,2 years ago,2021-11-18 21:37:09.690905,,,,0,109,355,https://www.google.com/maps/contrib/116680131049793729218/reviews?entry=ttu,True,,
ChIJdQ1jud1zhlQRrzO3fVYUkyg,The Home Depot,ChZDSUhNMG9nS0VJQ0FnSUNxbGZXWENREAE,Britney Waldron,5,This location is amazing  ! Bought a Aloe Vera plant    for only $6.00! Customer service was great and I m soo happy the kind cashier convinced me to sign up for the Home Depot rewards program  !,2 years ago,2021-11-18 21:37:09.693731,,,,0,175,140,https://www.google.com/maps/contrib/115530648566609567811/reviews?entry=ttu,True,,
ChIJdQ1jud1zhlQRrzO3fVYUkyg,The Home Depot,ChdDSUhNMG9nS0VJQ0FnSUNabG8taDF3RRAB,Paul Wing,5,Great  customer service  . . Parking.  Can see online before going there.,2 months ago,2023-09-18 21:37:09.696091,,,,0,219,25,https://www.google.com/maps/contrib/115164838205146382569/reviews?entry=ttu,True,,
ChIJdQ1jud1zhlQRrzO3fVYUkyg,The Home Depot,ChdDSUhNMG9nS0VJQ0FnSUMtck0zMzh3RRAB,Daniel Nanson,5,"We bought online to collect in store at 8th and Cambie - when we got there, we had to pick up bits we forgot to buy online. We got so much help, friendly and warm staff, we were kinda shocked how positive our experience was. Then at customer service, it got even better (Kaylan was amazing and super helpful). Not sure how they have managed to have so many good people there .but thank you big time.",a year ago,2022-11-18 21:37:09.698390,,,,2,83,,https://www.google.com/maps/contrib/115175854559735460833/reviews?entry=ttu,True,,
ChIJdQ1jud1zhlQRrzO3fVYUkyg,The Home Depot,ChZDSUhNMG9nS0VJQ0FnSUNScFp5OFdBEAE,MIKE  Checking in  BENNETT,5,Self checkouts are a bit confusing at first but can get in and get out in a short amount of time,7 months ago,2023-04-18 21:37:09.700512,,,,0,130,174,https://www.google.com/maps/contrib/108392977129004442392/reviews?entry=ttu,True,,
ChIJkSMu2SFuhlQRsWt-cSG8lf4,The Home Depot,ChdDSUhNMG9nS0VJQ0FnSURadmM3RGtRRRAB,Sassan Rakhshani,5,Always organized and helpfull team. It is smaller store comiare with other home depot stores with almost all their products. It is a Little boutique home depot.,a month ago,2023-10-18 21:37:10.262866,,,,0,263,6384,https://www.google.com/maps/contrib/117652649310988373905/reviews?entry=ttu,True,,
ChIJkSMu2SFuhlQRsWt-cSG8lf4,The Home Depot,ChZDSUhNMG9nS0VJQ0FnSURSOElqX1RnEAE,Tazmin Shariff,5,"I love this store! Whenever I ve come here for whatever product I find the staff very helpful, the prices are much cheaper than other places and they have a huge selection. Now that the garden works store in North Vancouver is closed I came here and discovered that they have the BEST  prices on their huge selection of pots, flowers, soil etc. They do need to change their entrance though. For those with disabilities it s a huge pain to go all the way around to one entrance. It makes more sense to have multiple entrances to welcome people into the store.",7 months ago,2023-04-18 21:37:10.265986,,,,0,117,22,https://www.google.com/maps/contrib/111753274024703060023/reviews?entry=ttu,True,,
ChIJkSMu2SFuhlQRsWt-cSG8lf4,The Home Depot,ChZDSUhNMG9nS0VJQ0FnSUNsNG9EMVZnEAE,TC,5,"They have amazing customer service here. Joy was very kind in helping me find what I needed and was able to answer the questions I had. She was very patient and friendly checking me out at the self checkout area as well, hope to see her again.",4 days ago,2023-11-14 21:37:10.268534,,,,0,42,4,https://www.google.com/maps/contrib/107338284484917319260/reviews?entry=ttu,True,,
ChIJkSMu2SFuhlQRsWt-cSG8lf4,The Home Depot,ChdDSUhNMG9nS0VJQ0FnSURGay0zQ2dRRRAB,Sym,5,"I had a great experience at Home Depot thanks to Reza! I was unsure about what to buy, but Reza provided excellent guidance on products and their uses. I really appreciate the help and knowledge shared. Thank you so much!",a week ago,2023-11-11 21:37:10.271328,,,,0,2,,https://www.google.com/maps/contrib/110717574927757772145/reviews?entry=ttu,False,,
ChIJkSMu2SFuhlQRsWt-cSG8lf4,The Home Depot,ChZDSUhNMG9nS0VJQ0FnSUNGdGZydk1nEAE,JL B,5,"I like Home Depot. Their prices are fair and the selection is good. But what stands out are the staff, many are retired tradesmen who are able to.provide accurate knowledge and guidance. Location is good with ample parking in the lot.",2 weeks ago,2023-11-04 21:37:10.273858,,,,0,33,1,https://www.google.com/maps/contrib/111159560251299929367/reviews?entry=ttu,True,,
ChIJkSMu2SFuhlQRsWt-cSG8lf4,The Home Depot,ChZDSUhNMG9nS0VJQ0FnSURadUptU2ZnEAE,Kamran Victory,5,"This store delivers the highest level of customer care.  Matt from the paint department is a Prince serving customers and he makes us feel like a king.  Reza is very professional,  attentive and committed to keeping customers happy.  Im grateful to shop here",a month ago,2023-10-18 21:37:10.276276,,,,0,26,1,https://www.google.com/maps/contrib/109665343369494847944/reviews?entry=ttu,True,,
ChIJkSMu2SFuhlQRsWt-cSG8lf4,The Home Depot,ChZDSUhNMG9nS0VJQ0FnSUNaX2I2aktnEAE,Kam Victory,5,"Im a loyal customer of Home Depot.  This branch is a mini store because the local authority doesnt allow them to sell lumber, drywall etc.  However they still have most things. Of great importance is the quality of the team.  Matt is a man with no hair but he has a million good qualities of a gentleman and delivers exceptional customer service.  He walks and talks like a member of the Royal family.  Heiter is a kind and attentive  cashier who is mindful and caring for the company. Salvatore knows everything about everything in construction,  or it appears that way to customers.  He helps and guides equally well in tools, electrical, plumbing, tiling.  Its a pleasure to meet him. Thank you Home Depot.",2 months ago,2023-09-18 21:37:10.278608,,,,0,80,13,https://www.google.com/maps/contrib/105076796309997157425/reviews?entry=ttu,False,,
ChIJkSMu2SFuhlQRsWt-cSG8lf4,The Home Depot,ChdDSUhNMG9nS0VJQ0FnSUNaLUx5X3VBRRAB,clifford ferris,5,The associate fadi at park royal Home Depot gave me fantastic service by explaining each product in detail and finding the right one for my sister husband for Christmas. I will definitely be recommending my friends to come and get helped by him.,2 months ago,2023-09-18 21:37:10.280732,,,,0,21,11,https://www.google.com/maps/contrib/115605590775809789162/reviews?entry=ttu,True,,
ChIJkSMu2SFuhlQRsWt-cSG8lf4,The Home Depot,ChdDSUhNMG9nS0VJQ0FnSURDMjRId2pBRRAB,Mark V. Sinclair,5,"Your friendly home improvement destination in West Vancouver with one-stop convenience. Centrally located at the Main Street intersection across from Simons, Home Depot - Park Royal carries a comprehensive array of quality products for all aspects of your home renovations conceived, and yet to be imagined. Update:  20th July 2022 Seasonal Outdoor Garden Centre: Home Depot at Park Royal Village has an Outdoor Garden Centre (open approx. early-April - September) which is located behind the store building.  Ample parking is available, in addition to carts for loading up flowers, plants, ceramic pots and supplies. I hadnt made a visit to H.D. Garden Centre since before Covid struck 2 years ago, but needed to replace an area of flower bed in back garden which had been planted, but which slugs had completely obliterated. The July Clearance has already begun but there are still very good quantities of ornamental Annuals, Perennials and Shrubs as well as a wide array of supplies (e.g., soil, fertilizer, slug bait [ yes, lol ;) ], patio ceramic pots and more) to be had. Awesome location, top-notch store and people. Highly recommended.",a year ago,2022-11-18 21:37:10.282805,,,,0,33,289,https://www.google.com/maps/contrib/102406716499936467366/reviews?entry=ttu,True,,
ChIJkSMu2SFuhlQRsWt-cSG8lf4,The Home Depot,ChdDSUhNMG9nS0VJQ0FnSUNwaGNEV3BnRRAB,Mason Haghjoo,5,"I had an outstanding experience at Home Depot in West Vancouver. Meena and Ivan exceeded my expectations by going the extra mile to address my concerns. It was truly surprising to encounter such kind-hearted individuals who were genuinely dedicated to solving my problem. Many thanks, Meena and Ivan, for your exceptional assistance!",3 months ago,2023-08-18 21:37:10.284801,,,,0,7,,https://www.google.com/maps/contrib/112200221569431137778/reviews?entry=ttu,False,,
ChIJkSMu2SFuhlQRsWt-cSG8lf4,The Home Depot,ChZDSUhNMG9nS0VJQ0FnSUNKcW96c2ZnEAE,Lei Chen,5,Love the store. Biggest drywall size is 2 by 2 and no long lumber over 8 feet here. And it s dog friendly !,4 months ago,2023-07-18 21:37:10.812625,,,,1,8,6,https://www.google.com/maps/contrib/106683698578964842963/reviews?entry=ttu,False,,
ChIJkSMu2SFuhlQRsWt-cSG8lf4,The Home Depot,ChdDSUhNMG9nS0VJQ0FnSUM2N3FHSHBBRRAB,Vahid Ghafarpour,5,"Home Depot Canada is the Canadian unit of the Home Depot and one of Canadas top home improvement retailers. The Canadian operation consists of 182 stores and employs over 28,000 people in Canada. Home Depot Canada has stores in all ten Canadian provinces and serves territorial Nunavut, Northwest Territories, and Yukon through electronic means (Online Sales). The Canadian head office is located in Toronto.",a month ago,2023-10-18 21:37:10.815725,,,,0,123,72,https://www.google.com/maps/contrib/115335302766693722923/reviews?entry=ttu,True,,
ChIJkSMu2SFuhlQRsWt-cSG8lf4,The Home Depot,ChdDSUhNMG9nS0VJQ0FnSURKbWV2Vmh3RRAB,Laurie Shone,5,"Had a problem with an online order. Spoke with Steph at customer service. She was super helpful, friendly and efficient. She was able to reorder. Thanks Steph! Give this girl a raise.",3 months ago,2023-08-18 21:37:10.818460,,,,0,13,14,https://www.google.com/maps/contrib/113741276384977893574/reviews?entry=ttu,False,,
ChIJkSMu2SFuhlQRsWt-cSG8lf4,The Home Depot,ChZDSUhNMG9nS0VJQ0FnSURKbm9yZE9BEAE,Coorosh Aryaii,5,"Aref is 5 star and he deserves it. Aref works at home depot located in North Vancouver/West Vancouver by the Park Royal. Aref has earned a five star review from me through his top excellent attitude, customer care skills, his kindness, his knowledge of product and his best top of the line service. Aref went beyond customers service by applying his knowledge of the product and knowledge of the cause of problem then after diagnosing the situation he offered the best solution and best product for my needs. After I returned home and checked it I found it exactly what Aref had told me was true and the product he sold was the best fit. Mr. Aref, congratulations, you have earned a 5 Star.",4 months ago,2023-07-18 21:37:10.821059,,,,0,3,,https://www.google.com/maps/contrib/105390452072272745720/reviews?entry=ttu,False,,
ChIJkSMu2SFuhlQRsWt-cSG8lf4,The Home Depot,ChdDSUhNMG9nS0VJQ0FnSURSZ0tpVXJnRRAB,D X,5,"Faye in the kitchen section was extremely helpful in helping me with moen faucet cartridge replacement. I called the store last Friday, Faye took the call and the cartridge was out of stock, so she said she will follow up with me when the cartridge is in. Surely, she notified me about the cartridge availability 6 days later. So I picked up the cartridge the same day, in talking to her at the store, I found she is also very knowledgeable about the products. Faye demonstrated true excellent customer service in going an extra mile for me. I recommend her and home depot store at West Vancouver. Thank you, Faye!",7 months ago,2023-04-18 21:37:10.823425,,,,1,1,,https://www.google.com/maps/contrib/115714427358307668645/reviews?entry=ttu,False,,
ChIJkSMu2SFuhlQRsWt-cSG8lf4,The Home Depot,ChdDSUhNMG9nS0VJQ0FnSUN4ajdQVXBnRRAB,Niloofar Moghaddam Tabrizi,5,"I wanna say thank to Jess. The Home Depot- Park royal >> garden part is so lucky to have him. Today I bought a bunch of rose plant and he helped me a lot. Although it was not his responsibility to help me changing the pot, he did his best to help me and make me satisfied. Thank you Jess",5 months ago,2023-06-18 21:37:10.825678,,,,0,8,1,https://www.google.com/maps/contrib/109759871881403875569/reviews?entry=ttu,False,,
ChIJkSMu2SFuhlQRsWt-cSG8lf4,The Home Depot,ChZDSUhNMG9nS0VJQ0FnSURKOFptbkFREAE,N A,5,"I think the price are a little higher than other places one time I went to buy curtains rods the price was double than Walmart store in Capilano Mall,But All staff members are helpful,knowledgeable .",3 months ago,2023-08-18 21:37:10.827791,,,,0,41,173,https://www.google.com/maps/contrib/102580020072896924614/reviews?entry=ttu,True,,
ChIJkSMu2SFuhlQRsWt-cSG8lf4,The Home Depot,ChdDSUhNMG9nS0VJQ0FnSUN4MTVLbXh3RRAB,Ali McJavid,5,"I recently interacted with NEGAR from the customer service team at Home Depot, and I must say she was exceptional. Negar displayed a high level of intelligence and was incredibly helpful throughout my experience. Her knowledge and assistance made my visit pleasant and straightforward. I highly recommend Negar for her outstanding customer service skills.",5 months ago,2023-06-18 21:37:10.830106,,,,0,12,1,https://www.google.com/maps/contrib/112541670776151159399/reviews?entry=ttu,False,,
ChIJkSMu2SFuhlQRsWt-cSG8lf4,The Home Depot,ChdDSUhNMG9nS0VJQ0FnSUN4b3RPcW1BRRAB,Jenni Watson,5,I bought a bbq today at Park Royal HD and the manager (I did not catch her name) went above and beyond to help me find a bbq and then help me load it into my vehicle. What a lovely and personable woman- so great to receive such great customer service. Thank you!!,6 months ago,2023-05-18 21:37:10.832176,,,,0,6,2,https://www.google.com/maps/contrib/105668060865325311174/reviews?entry=ttu,False,,
ChIJkSMu2SFuhlQRsWt-cSG8lf4,The Home Depot,ChdDSUhNMG9nS0VJQ0FnSURwbkpfWTNBRRAB,Rajinderpal singh,5,I met with one person name Mike p may be. He helped me alot to figure out from problem that  i was facing.Such a nice guy.,3 months ago,2023-08-18 21:37:10.834253,,,,0,2,,https://www.google.com/maps/contrib/107256096389975425881/reviews?entry=ttu,False,,
ChIJkSMu2SFuhlQRsWt-cSG8lf4,The Home Depot,ChdDSUhNMG9nS0VJQ0FnSUNZMDVuSXh3RRAB,Westcoaster Shells Paull,5,"I stopped in to look at lights, the Black Friday sales might not be listed as at this past weekend. Sign up for their pro extra rewards program.  Chris is always super nice on Cash!",4 days ago,2023-11-14 21:37:11.362729,,,,0,260,143,https://www.google.com/maps/contrib/115478868721388735550/reviews?entry=ttu,True,,
ChIJkSMu2SFuhlQRsWt-cSG8lf4,The Home Depot,ChdDSUhNMG9nS0VJQ0FnSURSamE3WHVBRRAB,Feri Amin,5,"I was at the garden Center yesterday, bought some plants and flowers, I d like to share, the person who helped me is Sanjay. He is knowledgeable, helpful, respectful and really nice guy.",6 months ago,2023-05-18 21:37:11.366029,,,,0,4,,https://www.google.com/maps/contrib/104639964532415595435/reviews?entry=ttu,False,,
ChIJkSMu2SFuhlQRsWt-cSG8lf4,The Home Depot,ChZDSUhNMG9nS0VJQ0FnSUNwNUpUNVdBEAE,Tara Elizabeth,5,Great spot for everything you need for home improvement. Super helpful staff too.,3 months ago,2023-08-18 21:37:11.368600,,,,0,515,1863,https://www.google.com/maps/contrib/104419197489852410664/reviews?entry=ttu,True,,
ChIJkSMu2SFuhlQRsWt-cSG8lf4,The Home Depot,ChdDSUhNMG9nS0VJQ0FnSUNwX3NmMjl3RRAB,stan beatty,5,"Great service, really helpful staff",3 months ago,2023-08-18 21:37:11.371225,,,,0,389,1457,https://www.google.com/maps/contrib/103419206714272402660/reviews?entry=ttu,True,,
ChIJkSMu2SFuhlQRsWt-cSG8lf4,The Home Depot,ChdDSUhNMG9nS0VJQ0FnSURKMHV5MXdBRRAB,Af Sh,5,"The store you can find paint, appliances, gardening, etc. High quality and helpful staff.",4 months ago,2023-07-18 21:37:11.373899,,,,0,282,206,https://www.google.com/maps/contrib/117237734905834326804/reviews?entry=ttu,True,,
